#CODE;ENGLISH;FRENCH;GERMAN;;SPANISH;;;;;;;;;x
EVTDESC200001;Colapse of the High Kingdom of Narnia;Colapse of the High Kingdom of Narnia;Colapse of the High Kingdom of Narnia;;Colapse of the High Kingdom of Narnia;;;;;;;;;x
EVTOPTA200001;damnum imperium;damnum imperium;damnum imperium;;damnum imperium;;;;;;;;;x
EVTDESCwinter_reb10;A messanger arrives bringing news that a White Stag has apeared in the northern wilds, shall we pursue it?;A messanger arrives bringing news that a White Stag has apeared in the northern wilds, shall we pursue it?;A messanger arrives bringing news that a White Stag has apeared in the northern wilds, shall we pursue it?;;A messanger arrives bringing news that a White Stag has apeared in the northern wilds, shall we pursue it?;;;;;;;;;x
EVTOPTAwinter_reb.10;We shall, Bring our horses and bows!;We shall, Bring our horses and bows!;We shall, Bring our horses and bows!;;We shall, Bring our horses and bows!;;;;;;;;;x
EVTOPTBwinter_reb.10;No, we should stay home.;No, we should stay home.;No, we should stay home.;;No, we should stay home.;;;;;;;;;x
EVTOPTAwinter_reb.12;Spare oom?;Spare oom?;Spare oom?;;Spare oom?;;;;;;;;;x
